{
  "backend": "faster-whisper",
  "model": "large-v3",
  "language": "zh",
  "segments": [
    {
      "start": 0.0,
      "end": 1.5,
      "text": "你好世界"
    },
    {
      "start": 1.5,
      "end": 3.0,
      "text": "测试一句"
    }
  ],
  "text": "你好世界测试一句",
  "duration": 3.0,
  "source": "sample.mp4"
}
